title,abstract ,date
10 key stats ahead of tonight's national TV slate,Get ready for tonight's games on NBA TV and TNT with five key stats to know about each matchup.,9 hours ago
8 must-see games on NBA League Pass this week,"With three weeks left in the regular season, every night has key games to watch as teams make their final push to climb the standings.","April 26, 2021"
FanDuel DFS Values Of The Night: Monday (Apr.26),A huge Monday means there's plenty of opportunity for value and FantasyPros is here to help you sort it out. ,"April 26, 2021"
Fantasy Basketball waiver wire pickups: Week 19,FantasyPros helps you figure out the best adds for this week in fantasy. ,"April 26, 2021"
10 key stats ahead of NBA TV doubleheader,Get ready for Monday's NBA TV doubleheader with five key stats to know about each matchup.,"April 26, 2021"
ICU nurse gets long-awaited meeting with Curry,A simple phrase used by a superstar player helped Shelby Delaney persevere in the medical field during the pandemic.,"April 26, 2021"
"Magic's Cannady has ankle surgery, will miss season",The former Princeton had surgery on the injury Mondan and will miss the rest of the 2020-21 campaign.,14 hours ago
Durant (thigh) available to play vs. Suns,The All-Star forward is ready to return to the floor after missing three games.,"April 25, 2021"
FanDuel DFS Values Of The Night: Sunday (Apr. 25),FantasyPros helps you find the most value out of Sunday's 7-game slate. ,"April 25, 2021"
10 key stats for ESPN doubleheader,Get ready for Sunday's ESPN doubleheader with five key stats to know about each matchup.,"April 25, 2021"
"Zion fastest to 2,000 points since Jordan",The 20-year-old phenom earns a spot alongside Hall of Famers Rick Barry and Elgin Baylor following his latest scoring feat.,"April 25, 2021"
"Magic's Clifford tests positive, will miss games","Clifford, who is not experiencing symptoms, received his second vaccination shot on Thursday.","April 26, 2021"
